sentence,article,cluster,entities,sentiment,bias_score
A juvenile humpback whale has been found dead after becoming entangled in a shark net off the New South Wales coast.,Juvenile humpback whale dies off NSW coast while entangled in shark net | Whales | The Guardian,8,New South Wales,0.009751462377607822,0.475
"The 8-metre whale, estimated to be two years old, was found wrapped in netting north of Wollongong on Tuesday, in waters between Coledale and Wombarra.",Juvenile humpback whale dies off NSW coast while entangled in shark net | Whales | The Guardian,8,"Wollongong, Coledale, Wombarra",0.04141158238053322,0.0
"It is the 15th whale entangled in shark nets along Australia’s east coast this year and the first whale to be confirmed dead, believed to have drowned on its migration south to Antarctica.",Juvenile humpback whale dies off NSW coast while entangled in shark net | Whales | The Guardian,8,Australia,0.006100079044699669,0.0
A spokesperson for the NSW department of primary industries and regional development said shark meshing contractors found the deceased whale during a routine inspection on Tuesday morning.,Juvenile humpback whale dies off NSW coast while entangled in shark net | Whales | The Guardian,8,NSW,0.02220183238387108,0.95
"“DPIRD did not receive any reports of a whale entanglement at Coledale prior to this,” they said, adding that no other whale entanglements in NSW shark nets had been reported this year.",Juvenile humpback whale dies off NSW coast while entangled in shark net | Whales | The Guardian,8,"DPIRD, NSW",0.023713964968919754,0.95
"However, In June, a whale became tangled in a shark drumline off Nobby’s beach in Newcastle.",Juvenile humpback whale dies off NSW coast while entangled in shark net | Whales | The Guardian,8,Newcastle,0.017259865999221802,0.0
"The NSW National Parks and Wildlife Service (NPWS), the Organisation for the Rescue and Research of Cetaceans in Australia (ORRCA) and Marine Rescue NSW responded on Tuesday afternoon, finding the juvenile with net tangled around its tail and side fin.",Juvenile humpback whale dies off NSW coast while entangled in shark net | Whales | The Guardian,-1,"The NSW National Parks and Wildlife Service, NPWS, the Organisation for the Rescue and Research of Cetaceans in Australia, ORRCA, Marine Rescue NSW",0.03052627481520176,0.0
"An NPWS spokesperson said: “The whale is estimated to be around two years old, weaned and independent from its mother.”",Juvenile humpback whale dies off NSW coast while entangled in shark net | Whales | The Guardian,8,NPWS,-0.005764306522905827,0.0
"“Everyone involved tried their best to disentangle the deceased whale,” said Marine Rescue NSW inspector Stuart Massey.",Juvenile humpback whale dies off NSW coast while entangled in shark net | Whales | The Guardian,8,"Marine Rescue NSW, Stuart Massey",-0.01777639612555504,0.0
"“The plan was to take the carcass to a location where it could be removed from the water,” he said.",Juvenile humpback whale dies off NSW coast while entangled in shark net | Whales | The Guardian,-1,,0.026875169947743416,0.0
"Shortly before 3pm, “the combination of unfavourable sea conditions and the proximity to rocks and the shoreline meant it was becoming unsafe for our vessel and crew to remain there, so we were forced to abandon”.",Juvenile humpback whale dies off NSW coast while entangled in shark net | Whales | The Guardian,60,,0.005115212872624397,0.0
Sign up: AU Breaking News email The whale carcass washed ashore on Tuesday night.,Juvenile humpback whale dies off NSW coast while entangled in shark net | Whales | The Guardian,55,,0.033903781324625015,0.0
"ORRCA said in a statement: “At this stage, the cause of death is unknown and will remain unclear until … a necropsy is carried out.”",Juvenile humpback whale dies off NSW coast while entangled in shark net | Whales | The Guardian,100,ORRCA,0.007582549937069416,0.0
The NPWS spokesperson said Wollongong city council would manage the carcass removal.,Juvenile humpback whale dies off NSW coast while entangled in shark net | Whales | The Guardian,82,"NPWS, Wollongong city council",0.02082330547273159,0.0
"There are 51 shark nets deployed in NSW, which are fitted with acoustic “whale alarms” and “dolphin pingers”.",Juvenile humpback whale dies off NSW coast while entangled in shark net | Whales | The Guardian,7,NSW,0.0333845429122448,0.95
"The devices “emit a high-frequency sound wave that deters the mammals from the area and reduces the chances of entanglement”, the DPIRD spokesperson said.",Juvenile humpback whale dies off NSW coast while entangled in shark net | Whales | The Guardian,6,DPIRD,-0.034881092607975006,0.0
“The NSW government will continue to investigate new shark mitigation technologies designed to minimise impacts on marine animals while protecting beachgoers.”,Juvenile humpback whale dies off NSW coast while entangled in shark net | Whales | The Guardian,7,NSW,-0.010853168554604053,0.95
The whale drowning has reignited calls for the NSW government to end its shark netting program.,Juvenile humpback whale dies off NSW coast while entangled in shark net | Whales | The Guardian,7,NSW,0.008359860628843307,0.95
"NSW Greens MP Cate Faehrmann said it was “absolutely heartbreaking to see a baby humpback whale die like this, especially because its death was totally preventable”.",Juvenile humpback whale dies off NSW coast while entangled in shark net | Whales | The Guardian,8,"NSW, Cate Faehrmann",0.007108371239155531,0.95
"“Every year when the nets go in, we see more whales and other wildlife like dolphins, endangered loggerhead turtles and critically endangered grey nurse sharks trapped, injured or killed.”",Juvenile humpback whale dies off NSW coast while entangled in shark net | Whales | The Guardian,7,,0.006669543217867613,0.0
"Dr Olaf Meynecke, who researches marine mammals at Griffith University, said there was little evidence to suggest that shark nets had prevented shark bites in the past.",Juvenile humpback whale dies off NSW coast while entangled in shark net | Whales | The Guardian,7,"Olaf Meynecke, Griffith University",0.035843100398778915,0.0
"The “large-scale removal of sharks along beaches as a mitigation measure” did little to reduce risk, he said.",Juvenile humpback whale dies off NSW coast while entangled in shark net | Whales | The Guardian,7,,0.00835440680384636,0.0
Meynecke said juvenile whales were at higher risk of entanglement and drowning.,Juvenile humpback whale dies off NSW coast while entangled in shark net | Whales | The Guardian,8,Meynecke,0.013341746293008327,0.0
“We know that they are not aware of the dangers of nets.”,Juvenile humpback whale dies off NSW coast while entangled in shark net | Whales | The Guardian,-1,,0.01749814674258232,0.0
"Whales develop experience over time, learning to communicate about dangerous locations, he said.",Juvenile humpback whale dies off NSW coast while entangled in shark net | Whales | The Guardian,7,,0.03600594773888588,0.0
A young whale “would panic quite quickly and if you’ve got high seas there is the risk of drowning”.,Juvenile humpback whale dies off NSW coast while entangled in shark net | Whales | The Guardian,8,,0.01482458971440792,0.0
Greens senator Peter Whish-Wilson said in a statement: “Governments can help keep ocean-goers safe by supercharging investment in modern-day alternatives to outdated and ineffective shark nets and drumlines.,Juvenile humpback whale dies off NSW coast while entangled in shark net | Whales | The Guardian,7,"Greens, Peter Whish-Wilson",-0.017820114269852638,0.0
"“These include subsidising shark shield personal deterrent devices, shark spotter programs, eco-shark barriers, bite-proof wetsuits, and improving public education.",Juvenile humpback whale dies off NSW coast while entangled in shark net | Whales | The Guardian,7,,-0.0254164207726717,0.0
"A 2017 Senate inquiry into shark risk mitigation recommended the federal government show national leadership on driving this investment, but this has so far been ignored.”",Juvenile humpback whale dies off NSW coast while entangled in shark net | Whales | The Guardian,7,Senate,0.028485596179962158,0.0
Whish-Wilson also called on the federal government to remove an exemption in the national environment law that allows state-controlled shark cull programs.,Juvenile humpback whale dies off NSW coast while entangled in shark net | Whales | The Guardian,7,Whish-Wilson,0.028997421264648438,0.0
“Federal law enables the state-sanctioned animal cruelty that we’re seeing off our Queensland and NSW coastlines through a dangerous and archaic EPBC exemption.,Juvenile humpback whale dies off NSW coast while entangled in shark net | Whales | The Guardian,7,"Queensland, NSW",0.005650805775076151,0.95
“It’s time to end the world’s longest marine cull and stop this barbaric government-sanctioned animal cruelty.”,Juvenile humpback whale dies off NSW coast while entangled in shark net | Whales | The Guardian,7,,0.02107532136142254,0.0
"The number of students who spent their last weeks of high school preparing for a final exam on the wrong Caesar has grown to 140 across nine schools, with the state’s education minister suggesting they would not be expected to sit the test.",Et tu? More Queensland high schools taught wrong Caesar topic | Queensland | The Guardian,105,Caesar,0.01206136029213667,0.0
"But the minister, John-Paul Langbroek, could not clarify how those year 12 students would be tested, hours before their fellow budding classicists from around the state prepared to answer questions about their knowledge of Julius Caesar.",Et tu? More Queensland high schools taught wrong Caesar topic | Queensland | The Guardian,105,"John-Paul Langbroek, Julius Caesar",0.016005927696824074,0.0
"Students from nine schools stretching from Cairns, in the state’s far north, down to Brisbane had been preparing for an external exam on his adopted son and heir, Augustus.",Et tu? More Queensland high schools taught wrong Caesar topic | Queensland | The Guardian,105,"Cairns, Brisbane, Augustus",-0.015945417806506157,0.0
They learned of the curriculum misadventure this week – hours before the exam was to be sat on Wednesday afternoon.,Et tu? More Queensland high schools taught wrong Caesar topic | Queensland | The Guardian,105,,0.012223560363054276,0.0
"Langbroek said he was “very unhappy” to learn of the situation, indicating heads would roll at the Queensland Curriculum and Assessment Authority (QCAA), adding that news of the mistake would be “extremely traumatic” to students and their parents.",Et tu? More Queensland high schools taught wrong Caesar topic | Queensland | The Guardian,-1,"Langbroek, the Queensland Curriculum and Assessment Authority, QCAA",0.0048140655271708965,0.0
Sign up: AU Breaking News email,Et tu? More Queensland high schools taught wrong Caesar topic | Queensland | The Guardian,55,AU Breaking News,-0.011711234226822853,0.0
"“I want to reassure those students – and their parents, and their teachers – affected that we will be making every investigation into how this happened,” he said on Wednesday.",Et tu? More Queensland high schools taught wrong Caesar topic | Queensland | The Guardian,105,,-0.051854729652404785,0.0
"The minister tried to reassure students that the bungle would not be “the end of the world”, saying that the 75% of the course mark for which they had already been tested would be “scaled up” to make sure they were not disadvantaged.",Et tu? More Queensland high schools taught wrong Caesar topic | Queensland | The Guardian,105,,-0.10480346530675888,0.0
"Asked whether that made Wednesday’s test “null and void”, or if not, what the exam would look like",Et tu? More Queensland high schools taught wrong Caesar topic | Queensland | The Guardian,105,,0.028503982350230217,0.0
", Langbroek said he did not have the details.",Et tu? More Queensland high schools taught wrong Caesar topic | Queensland | The Guardian,-1,Langbroek,0.012407151982188225,0.0
"“I’m not sure about the actual process of what is happening with the examination,” he said.",Et tu? More Queensland high schools taught wrong Caesar topic | Queensland | The Guardian,-1,,0.011049631983041763,0.0
“But I can’t see how anyone would be expected to do an exam having had two days’ preparation.”,Et tu? More Queensland high schools taught wrong Caesar topic | Queensland | The Guardian,-1,,0.020683983340859413,0.0
Langbroek said the department was yet to find the cause,Et tu? More Queensland high schools taught wrong Caesar topic | Queensland | The Guardian,-1,Langbroek,0.012500427663326263,0.0
of the error,Et tu? More Queensland high schools taught wrong Caesar topic | Queensland | The Guardian,103,,0.0348053015768528,0.0
"“I have directed the director general of the Department of Education to urgently investigate how the QCAA communicates with schools to implement syllabus changes,” Langbroek said.",Et tu? More Queensland high schools taught wrong Caesar topic | Queensland | The Guardian,-1,"the Department of Education, QCAA, Langbroek",0.03597511723637581,0.0
The minister said he would seek to “make sure” the resources given to and planning done at the QCAA was “appropriately guided in future” to avoid a repeat of the bungle.,Et tu? More Queensland high schools taught wrong Caesar topic | Queensland | The Guardian,-1,QCAA,0.05040794238448143,0.0
He noted the board had already seen “some changes” since the Crisafulli government came to power a year ago.,Et tu? More Queensland high schools taught wrong Caesar topic | Queensland | The Guardian,104,Crisafulli,-0.011216837912797928,0.475
"The schools affected are: Brisbane state high school, Flagstone community college, Meridan state college, Redcliffe state high school, Yeronga state high school, Saint Teresa’s Catholic college, West Moreton Anglican college, James Nash state high school and Kuranda district state college.",Et tu? More Queensland high schools taught wrong Caesar topic | Queensland | The Guardian,106,"Brisbane, Flagstone, Meridan, Redcliffe, Yeronga, Saint Teresa’s, West Moreton Anglican college, James Nash, Kuranda",0.0173516646027565,0.0
"Along the borders of Uganda, Rwanda and the DRC lies the Virunga national park – the home of mountain gorillas.",The comeback of the mountain gorilla – podcast | Wildlife | The Guardian,-1,"Uganda, Rwanda, DRC",-0.010508019477128983,0.0
Back in 1970s there were only a few hundred of these gorillas left.,The comeback of the mountain gorilla – podcast | Wildlife | The Guardian,-1,,0.06026475504040718,0.0
"Yet today the community is thriving with more than 1,000.",The comeback of the mountain gorilla – podcast | Wildlife | The Guardian,-1,,-0.004293297417461872,0.0
"Patrick Greenfield, the Guardian’s biodiversity reporter, headed up into the Virunga mountains, guided by wildlife vets, to find out how they achieved this rare and extraordinary conservation success.",The comeback of the mountain gorilla – podcast | Wildlife | The Guardian,-1,"Patrick Greenfield, Guardian",-0.004023008048534393,0.0
He tells Annie Kelly how the gorillas have been protected in such a volatile area.,The comeback of the mountain gorilla – podcast | Wildlife | The Guardian,-1,Annie Kelly,0.04880354925990105,0.0
Tanzania’s president looks on course to strengthen her grip on the country as it holds a general election on Wednesday against the backdrop of rapidly intensifying repression and the exclusion of opposition candidates.,Tanzanian president poised to retain power as rivals barred from election | Tanzania | The Guardian,103,Tanzania,-0.029067805036902428,0.95
"Samia Suluhu Hassan, a former vice-president who took office after the death of her predecessor, John Magufuli, in 2021, has left nothing to chance for her first presidential and parliamentary electoral test.",Tanzanian president poised to retain power as rivals barred from election | Tanzania | The Guardian,98,"Samia Suluhu Hassan, John Magufuli",0.03002304956316948,0.0
"Candidates from the two main opposition parties in the east African country have been disqualified, opposition gatherings have been banned and government critics have been abducted, killed or arrested.",Tanzanian president poised to retain power as rivals barred from election | Tanzania | The Guardian,98,,0.00421992689371109,0.0
"Analysts say they expect voter apathy, possible unrest over the stifling of opposition voices, and the further entrenchment of Hassan and the ruling CCM party.",Tanzanian president poised to retain power as rivals barred from election | Tanzania | The Guardian,98,"Hassan, CCM",0.00836574099957943,0.95
"“Tanzania will never be the same after this election,” said Deus Valentine, the chief executive of the Center for Strategic Litigation, a non-profit organisation based in Dar es Salam, a commercial port city on Tanzania’s Indian Ocean coast.",Tanzanian president poised to retain power as rivals barred from election | Tanzania | The Guardian,103,"Tanzania, Deus Valentine, the Center for Strategic Litigation, Dar es Salam, Tanzania",0.011598422192037106,0.95
"“We are either entering a completely new paradigm or level of impunity, or we are entering a completely new level of civil defiance.",Tanzanian president poised to retain power as rivals barred from election | Tanzania | The Guardian,103,,0.017762046307325363,0.0
Something is going to give.”,Tanzanian president poised to retain power as rivals barred from election | Tanzania | The Guardian,-1,,-0.014577026478946209,0.0
"Hassan started her tenure by undoing some of Magufuli’s authoritarian and repressive policies, including ending a ban on political rallies and making reconciliatory moves with the opposition.",Tanzanian president poised to retain power as rivals barred from election | Tanzania | The Guardian,98,"Hassan, Magufuli",0.045874983072280884,0.7124999999999999
"Along the way, she gained local and international approval.",Tanzanian president poised to retain power as rivals barred from election | Tanzania | The Guardian,108,,-0.004554461222141981,0.0
"But she later backtracked and her administration has been accused of overseeing a grim return to the repression of the past, dashing hopes of lasting change.",Tanzanian president poised to retain power as rivals barred from election | Tanzania | The Guardian,103,,0.004212790634483099,0.0
"In June, after the reported disappearance and torture of two activists, Boniface Mwangi of Kenya and Agather Atuhaire of Uganda, UN experts called on the Tanzanian government to “immediately stop the enforced disappearance of political opponents, human rights defenders and journalists”.",Tanzanian president poised to retain power as rivals barred from election | Tanzania | The Guardian,103,"Boniface Mwangi, Kenya, Agather Atuhaire, Uganda, UN",0.009651286527514458,0.475
The UN experts said more than 200 cases of enforced disappearance had been recorded in Tanzania since 2019.,Tanzanian president poised to retain power as rivals barred from election | Tanzania | The Guardian,103,"UN, Tanzania",0.010062484070658684,0.7124999999999999
A wave of abductions in the lead-up to this election has increased public anger against Hassan.,Tanzanian president poised to retain power as rivals barred from election | Tanzania | The Guardian,98,Hassan,0.006679688114672899,0.95
"One of those taken was Humphrey Polepole, a CCM insider who had resigned from his role as ambassador to Cuba and become a vocal critic of the government, CCM and Hassan’s leadership.",Tanzanian president poised to retain power as rivals barred from election | Tanzania | The Guardian,98,"Humphrey Polepole, CCM, Cuba, CCM, Hassan",0.010778984054923058,0.95
His family said he was abducted by unknown individuals early this month.,Tanzanian president poised to retain power as rivals barred from election | Tanzania | The Guardian,-1,,0.009152239188551903,0.0
"In June, Tanzanian police dismissed claims of increasing abductions and disappearances, claiming some were staged.",Tanzanian president poised to retain power as rivals barred from election | Tanzania | The Guardian,103,,0.00866159051656723,0.0
Hassan has in the past ordered an investigation into abduction reports but the findings have not been made public.,Tanzanian president poised to retain power as rivals barred from election | Tanzania | The Guardian,-1,Hassan,0.010341203771531582,0.0
A crackdown on opposition parties has intensified in recent months.,Tanzanian president poised to retain power as rivals barred from election | Tanzania | The Guardian,98,,0.02928807958960533,0.0
"In April, Tundu Lissu, the vice-chair of the leading opposition party, Chadema, was arrested and charged with treason and cybercrime offences.",Tanzanian president poised to retain power as rivals barred from election | Tanzania | The Guardian,98,"Tundu Lissu, Chadema",0.008574021980166435,0.95
"His party, which has led calls for a boycott of the election unless electoral systems are reformed, was later disqualified from participating.",Tanzanian president poised to retain power as rivals barred from election | Tanzania | The Guardian,98,,0.006744693964719772,0.0
"Last month Luhaga Mpina, the leader of ACT-Wazalendo, another opposition party, was also disqualified, meaning Hassan will contest only lesser-known candidates from minor parties.",Tanzanian president poised to retain power as rivals barred from election | Tanzania | The Guardian,98,"Luhaga Mpina, ACT-Wazalendo, Hassan",0.011055554263293743,0.7124999999999999
"Nicodemus Minde, a researcher with the Institute for Security Studies, said at a seminar organised by the institute: “The political landscape going into the election remains sharply polarised, with opposition leaders facing legal harassment and civic space that has been constrained.”",Tanzanian president poised to retain power as rivals barred from election | Tanzania | The Guardian,98,"Nicodemus Minde, the Institute for Security Studies",0.013522649183869362,0.0
He said the absence of Chadema and ACT-Wazalendo from the ballot had made this election “arguably the least competitive” since the reintroduction of multiparty politics in 1992.,Tanzanian president poised to retain power as rivals barred from election | Tanzania | The Guardian,98,"Chadema, ACT-Wazalendo",0.011928273364901543,0.7124999999999999
"CCM and its predecessor TANU have ruled the country since independence in 1961, making it one of the longest-ruling political forces in Africa.",Tanzanian president poised to retain power as rivals barred from election | Tanzania | The Guardian,98,"CCM, TANU",-0.015246219001710415,0.95
Hassan’s administration has pointed to plaudits for Tanzania’s economic growth and low inflation under her watch.,Tanzanian president poised to retain power as rivals barred from election | Tanzania | The Guardian,103,"Hassan, Tanzania",-0.004863305948674679,0.95
She is campaigning on promises to focus on strengthening healthcare and education and provide economic empowerment to uplift lives and foster inclusive growth.,Tanzanian president poised to retain power as rivals barred from election | Tanzania | The Guardian,108,,-0.006350179668515921,0.0
"“In our current and forthcoming manifestos, we are focusing on the people,” Hassan said at a campaign rally in the eastern district of Temeke last week.",Tanzanian president poised to retain power as rivals barred from election | Tanzania | The Guardian,98,"Hassan, Temeke",-0.00674926582723856,0.95
“Our goal is to make sure that every Tanzanian has a chance to participate meaningfully in the nation’s economic growth.”,Tanzanian president poised to retain power as rivals barred from election | Tanzania | The Guardian,103,,-0.0062453546561300755,0.0
"Among those being allowed to run against CCM is Salum Mwalimu, a running mate of Lissu during the 2000 presidential election.",Tanzanian president poised to retain power as rivals barred from election | Tanzania | The Guardian,98,"CCM, Salum Mwalimu, Lissu",-0.011748169548809528,0.7124999999999999
"He is running for the Chaumma party, which is made up of many Chadema defectors.",Tanzanian president poised to retain power as rivals barred from election | Tanzania | The Guardian,98,"Chaumma, Chadema",0.02271157130599022,0.95
"Mwalimu’s campaign promises include reforms to government systems, including delivering a new constitution.",Tanzanian president poised to retain power as rivals barred from election | Tanzania | The Guardian,103,Mwalimu,-0.009326375089585781,0.0
"“Tanzanians should expect great change from our party, which is committed to transforming the country,” he said at the national electoral commission last month when he went to collect presidential nomination forms.",Tanzanian president poised to retain power as rivals barred from election | Tanzania | The Guardian,103,,-0.006210079416632652,0.0
Observers say Hassan’s opponents lack the resources and name recognition to compete with the countrywide party machinery that CCM has built over the decades and benefited from to entrench its rule.,Tanzanian president poised to retain power as rivals barred from election | Tanzania | The Guardian,98,"Hassan, CCM",0.02733559161424637,0.95
"In the 2020 presidential election, Magufuli won with 84.4% of the vote and Lissu was second with 13.04%.",Tanzanian president poised to retain power as rivals barred from election | Tanzania | The Guardian,98,"Magufuli, Lissu",-0.01317683421075344,0.475
More than 37 million people are eligible to vote.,Tanzanian president poised to retain power as rivals barred from election | Tanzania | The Guardian,98,,-0.01195391733199358,0.0
