sentence,article,cluster,entities,sentiment,bias_score
An agitated one will open its mouth wide and yawn as aggressive display.,"'I was up to my waist down a hippo's throat.' He survived, and here's his advice",-1,,0.03095311112701893,0.0
"Also watch for a head thrown back, shaking of the head, grunting and snorting.","'I was up to my waist down a hippo's throat.' He survived, and here's his advice",113,,0.01978212781250477,0.0
“These are signs you should have left already!” Muruthi said.,"'I was up to my waist down a hippo's throat.' He survived, and here's his advice",69,Muruthi,0.06901761889457703,0.475
"If you’ve attracted unwanted attention, Muruthi said to always remember you cannot outrun a hippo.","'I was up to my waist down a hippo's throat.' He survived, and here's his advice",-1,Muruthi,0.035768669098615646,0.0
"They may look sluggish, but they can run 30 mph (almost 43 kph).","'I was up to my waist down a hippo's throat.' He survived, and here's his advice",61,,-0.028706779703497887,0.0
"Instead, you should try to climb a tree or find an obstacle to put between you and the hippo such as a rock or anthill.","'I was up to my waist down a hippo's throat.' He survived, and here's his advice",70,,0.07531716674566269,0.0
"Muruthi, Lewison and Templer all said never stay between a hippo and the water.","'I was up to my waist down a hippo's throat.' He survived, and here's his advice",70,"Muruthi, Lewison, Templer",0.07250665873289108,0.9499999999999998
"If it’s charging you, run parallel to the water source.","'I was up to my waist down a hippo's throat.' He survived, and here's his advice",-1,,0.06069216504693031,0.0
"As with so many other protective female animals, never get between a mama hippo and her young, Templer said.","'I was up to my waist down a hippo's throat.' He survived, and here's his advice",70,Templer,-0.04961792752146721,0.95
What if you’re in a small watercraft?,"'I was up to my waist down a hippo's throat.' He survived, and here's his advice",113,,-0.017416782677173615,0.0
"“Typically, if a hippo is going to be attacking, you’ll see it coming way before.","'I was up to my waist down a hippo's throat.' He survived, and here's his advice",70,,0.03769654408097267,0.0
There will be that bow wave. …,"'I was up to my waist down a hippo's throat.' He survived, and here's his advice",114,,-0.051347021013498306,0.0
"If you slap the water, the percussion 99.9 times out of 100 will turn the hippo,” Templer said.","'I was up to my waist down a hippo's throat.' He survived, and here's his advice",70,Templer,-0.05900963023304939,0.95
"“If you’re in a canoe and a hippo knocks you in the water, get away from the canoe.","'I was up to my waist down a hippo's throat.' He survived, and here's his advice",70,,0.04655381292104721,0.0
"The hippo is going for this big shape, getting it off its territory.”","'I was up to my waist down a hippo's throat.' He survived, and here's his advice",70,,-0.049261510372161865,0.0
"It’s also safer to view hippos on the water in a larger vessel, which the animal would have a harder time capsizing, Muruthi said.","'I was up to my waist down a hippo's throat.' He survived, and here's his advice",70,Muruthi,-0.09809073060750961,0.95
"Once an attack is underway Unlike attacks by some other wild animals, humans are almost defenseless once an attack by a large hippo begins.","'I was up to my waist down a hippo's throat.' He survived, and here's his advice",70,,0.035621028393507004,0.0
"“Once attacked, there is nothing you can do,” Muruthi said.","'I was up to my waist down a hippo's throat.' He survived, and here's his advice",69,Muruthi,0.01755034364759922,0.475
“Fight for dear life and watch for any chance to escape.”,"'I was up to my waist down a hippo's throat.' He survived, and here's his advice",118,,-0.06835951656103134,0.0
He said you could try to poke at the eyes or any spot that might inflict unexpected pain.,"'I was up to my waist down a hippo's throat.' He survived, and here's his advice",-1,,0.01936744526028633,0.0
"But given the size just of a hippo head, even that’s a tall order.","'I was up to my waist down a hippo's throat.' He survived, and here's his advice",70,,0.05988048389554024,0.0
"“Hippos typically hole punch you, so there isn’t much you can do if they get hold of you,” Lewison said.","'I was up to my waist down a hippo's throat.' He survived, and here's his advice",70,Lewison,0.010221567004919052,0.95
"Based on his attack, Templer said try not to panic “when dragged underwater.","'I was up to my waist down a hippo's throat.' He survived, and here's his advice",73,Templer,0.04939601942896843,0.95
Remember to suck in air if on the surface.”,"'I was up to my waist down a hippo's throat.' He survived, and here's his advice",113,,-0.07571466267108917,0.0
Another hippo attack survivor in this National Geographic video also was able to conserve her breath.,"'I was up to my waist down a hippo's throat.' He survived, and here's his advice",70,National Geographic,-0.0664028525352478,0.475
"She also grabbed the hippo’s snout, and one expert in the video theorizes that might have startled the hippo into letting her go.","'I was up to my waist down a hippo's throat.' He survived, and here's his advice",70,,0.024612607434391975,0.0
‘You’re the sum of your choices’,"'I was up to my waist down a hippo's throat.' He survived, and here's his advice",117,,-0.05141541734337807,0.0
"Two years after that attack, Templer said that he and a team made the longest recorded descent of the Zambezi River to date.","'I was up to my waist down a hippo's throat.' He survived, and here's his advice",-1,Templer,0.054571736603975296,0.0
"It took three months and covered 1,600 miles (2,575 kilometers).","'I was up to my waist down a hippo's throat.' He survived, and here's his advice",-1,,-0.00983535498380661,0.0
How did Templer find the resilience to reclaim his life?,"'I was up to my waist down a hippo's throat.' He survived, and here's his advice",73,Templer,-0.040950749069452286,0.95
"After a particularly rough day trying to maneuver in a wheelchair, he said that his surgeon told him: “You’re the sum of your choices.","'I was up to my waist down a hippo's throat.' He survived, and here's his advice",-1,,0.1266094148159027,0.0
"You’re exactly who, what and where you choose to be in life.”","'I was up to my waist down a hippo's throat.' He survived, and here's his advice",117,,-0.025829631835222244,0.0
Templer said he focused on what’s possible vs. what he’s lost.,"'I was up to my waist down a hippo's throat.' He survived, and here's his advice",73,Templer,0.07802511006593704,0.95
"“If you look for what’s possible, it generally is.”","'I was up to my waist down a hippo's throat.' He survived, and here's his advice",118,,-0.007017137482762337,0.0
Templer later moved to United States; got married to the sister of a journalist on the record-setting Zambezi trip; wrote the book “What’s Left of Me”; and is a speaker.,"'I was up to my waist down a hippo's throat.' He survived, and here's his advice",73,"Templer, United States",-0.007140252739191055,0.95
Is a safari advisable?,"'I was up to my waist down a hippo's throat.' He survived, and here's his advice",-1,,-0.04804543778300285,0.0
Should people be afraid to even go on safari – especially in hippo areas – after learning of a harrowing story like Templer’s?,"'I was up to my waist down a hippo's throat.' He survived, and here's his advice",-1,Templer,0.0057674129493534565,0.0
"Muruthi said go, but go smartly.","'I was up to my waist down a hippo's throat.' He survived, and here's his advice",69,Muruthi,-0.08521337807178497,0.475
"Be sure to get advice from professional tour guides – and then follow their guidance, Muruthi said.","'I was up to my waist down a hippo's throat.' He survived, and here's his advice",69,Muruthi,-0.011016776785254478,0.475
"“In Kenya, for example, contact the Kenya Professional Safari Guides Association,” he said.","'I was up to my waist down a hippo's throat.' He survived, and here's his advice",-1,"Kenya, the Kenya Professional Safari Guides Association",-0.008260255679488182,0.0
"Templer said his attack was an “anomaly,” and he doesn’t want anyone to be dissuaded by what happened on his 1996 river run.","'I was up to my waist down a hippo's throat.' He survived, and here's his advice",73,Templer,0.02154640667140484,0.95
“My biggest counsel would be: Absolutely go and do it.,"'I was up to my waist down a hippo's throat.' He survived, and here's his advice",118,,-0.024874018505215645,0.0
But hook yourself up with someone who knows what they’re doing out there.,"'I was up to my waist down a hippo's throat.' He survived, and here's his advice",-1,,-0.046884339302778244,0.0
"But by all means, go out … and experience it.”","'I was up to my waist down a hippo's throat.' He survived, and here's his advice",-1,,-0.01822824962437153,0.0
"Editor’s Note: Sign up for Unlocking the World, CNN Travel’s weekly newsletter.",They bought an abandoned 'ghost house' in the Japanese countryside,55,CNN Travel’s,-0.004006285220384598,0.0
"Get the latest news in aviation, food and drink, where to stay and other travel developments.",They bought an abandoned 'ghost house' in the Japanese countryside,-1,,-0.014272522181272507,0.0
"He’d spent years backpacking around the world, and Japanese traveler Daisuke Kajiyama was finally ready to return home to pursue his long-held dream of opening up a guesthouse.",They bought an abandoned 'ghost house' in the Japanese countryside,29,Daisuke Kajiyama,-0.0038933781906962395,0.0
"In 2011, Kajiyama arrived back in Japan with his Israeli partner Hila, who he met in Nepal, and the pair set about finding the perfect location for their future venture.",They bought an abandoned 'ghost house' in the Japanese countryside,29,"Kajiyama, Japan, Hila, Nepal",-0.0040016015991568565,0.8312499999999999
"However, there were a couple of major stumbling blocks in their way.",They bought an abandoned 'ghost house' in the Japanese countryside,-1,,0.01760535128414631,0.0
"To start with, Kajiyama had very little money to speak of after years of globetrotting around destinations like Korea, Taiwan, India, Nepal, Guatemala, Cuba and Canada.",They bought an abandoned 'ghost house' in the Japanese countryside,29,"Kajiyama, Korea, Taiwan, India, Nepal, Guatemala, Cuba, Canada",0.03789133206009865,0.7124999999999999
"He also happened to have his heart set on a traditional Japanese house, typically known as kominka, which are usually passed down over generations.",They bought an abandoned 'ghost house' in the Japanese countryside,29,,-0.01032197941094637,0.0
"“I wanted to have a traditional house in the countryside,” Kajiyama tells CNN Travel, explaining that he was determined to find two houses located next to each other, so that he and Hila could live in one, while the other would be a guesthouse that they’d run together.",They bought an abandoned 'ghost house' in the Japanese countryside,29,"Kajiyama, CNN Travel, Hila",-0.010569549165666103,0.95
“I had a vision.”,They bought an abandoned 'ghost house' in the Japanese countryside,117,,-0.011252515017986298,0.0
Guesthouse dream,They bought an abandoned 'ghost house' in the Japanese countryside,29,,-0.07139118015766144,0.0
"When he was unable to find anything that met his requirements, Kajiyama decided to shift his search to include the growing number of abandoned homes in the country.",They bought an abandoned 'ghost house' in the Japanese countryside,29,Kajiyama,0.02114199288189411,0.95
"As younger people ditch rural areas in pursuit of jobs in the city, Japan’s countryside is becoming filled with “ghost” houses, or “akiya.”",They bought an abandoned 'ghost house' in the Japanese countryside,29,Japan,0.020158259198069572,0.95
"According to the Japan Policy Forum, there were 61 million houses and 52 million households in Japan in 2013, and with the country’s population expected to decline from 127 million to about 88 million by 2065, this number is likely to increase.",They bought an abandoned 'ghost house' in the Japanese countryside,29,"the Japan Policy Forum, Japan",0.04697545990347862,0.95
"Kajiyama was driving around Tamatori, a small village located in the Shizuoka prefecture, between Kyoto and Tokyo, surrounded by green tea plantations and rice fields, when he came across an elderly woman farming, and decided to approach her.",They bought an abandoned 'ghost house' in the Japanese countryside,29,"Kajiyama, Tamatori, the Shizuoka prefecture, Kyoto, Tokyo",-0.008493676781654358,0.7916666666666666
“I said ‘Do you know if there are any empty houses around here?’,They bought an abandoned 'ghost house' in the Japanese countryside,-1,,0.03645654022693634,0.0
"And she just pointed,” he recalls.",They bought an abandoned 'ghost house' in the Japanese countryside,117,,-0.014063248410820961,0.0
He looked over at the area that she was signaling to and spotted two neglected houses side by side – a former green tea factory and an old farmer’s home – located close to a river.,They bought an abandoned 'ghost house' in the Japanese countryside,29,,0.03281883895397186,0.0
Both properties had been uninhabited for at least seven years and needed a huge amount of work.,They bought an abandoned 'ghost house' in the Japanese countryside,29,,0.017283881083130836,0.0
Kajiyama asked the woman to contact the owner to find out if they’d be interested in selling.,They bought an abandoned 'ghost house' in the Japanese countryside,29,Kajiyama,-0.023014049977064133,0.95
"“The owner said that no one could live there, as it was abandoned,” he says.",They bought an abandoned 'ghost house' in the Japanese countryside,107,,0.010737587697803974,0.0
“But he didn’t say ‘no.’,They bought an abandoned 'ghost house' in the Japanese countryside,119,,0.03210698440670967,0.0
Everybody was always saying ‘no.’,They bought an abandoned 'ghost house' in the Japanese countryside,119,,0.03505852818489075,0.0
But he didn’t.,They bought an abandoned 'ghost house' in the Japanese countryside,-1,,0.07443324476480484,0.0
So I felt there was a small chance.”,They bought an abandoned 'ghost house' in the Japanese countryside,117,,0.10866747796535492,0.0
"Ghost house Kajiyama returned to visit the houses around five times, before going to visit the owner himself to negotiate an agreement that would see him use the old green tree factory as a home, and convert the farmer’s house into the guesthouse he’d always envisioned.",They bought an abandoned 'ghost house' in the Japanese countryside,29,Kajiyama,-0.006921595893800259,0.95
"While he was keen to purchase both of the homes, he explains that the traditions around home ownership in Japan mean that he is unable to do so until it’s passed down to the son of the current owner.",They bought an abandoned 'ghost house' in the Japanese countryside,29,Japan,0.04726099595427513,0.95
"“They said ‘if you take all the responsibility yourself, you can take it.’",They bought an abandoned 'ghost house' in the Japanese countryside,112,,-0.03142924979329109,0.0
"So we made an agreement on paper,” he says.",They bought an abandoned 'ghost house' in the Japanese countryside,91,,-0.00885933730751276,0.0
"Both he and Hila were aware that they had a lot of work ahead of them, but the couple, who married in 2013, were thrilled to be one step closer to having their own guesthouse in an ideal spot.",They bought an abandoned 'ghost house' in the Japanese countryside,29,Hila,-0.002923808991909027,0.95
"“It’s a very nice location,” says Kajiyama.",They bought an abandoned 'ghost house' in the Japanese countryside,29,Kajiyama,-0.003007604042068124,0.95
"“It’s close to the city, but it’s really countryside.",They bought an abandoned 'ghost house' in the Japanese countryside,-1,,-0.03019110858440399,0.0
Also people still live here and go to work [in the city].,They bought an abandoned 'ghost house' in the Japanese countryside,87,,-0.035492848604917526,0.0
"“The house is also in front of the river, so when you go to sleep you can hear the sound of the water.”",They bought an abandoned 'ghost house' in the Japanese countryside,-1,,-0.007085088174790144,0.0
"According to Kajiyama, the process of clearing the house, which is around 90 years old, before beginning the renovation works was one of the hardest parts of the process, simply because there was so much stuff to sort through.",They bought an abandoned 'ghost house' in the Japanese countryside,29,Kajiyama,0.0224913340061903,0.95
"However, he was able to repurpose some of the items.",They bought an abandoned 'ghost house' in the Japanese countryside,-1,,-0.022502847015857697,0.0
"During the first year, he spent a lot of time connecting with locals, gaining knowledge about the home, and helping the local farmers with farming for the first year or so.",They bought an abandoned 'ghost house' in the Japanese countryside,29,,-0.004211971070617437,0.0
Authentic style,They bought an abandoned 'ghost house' in the Japanese countryside,118,,-0.04624776169657707,0.0
"Although he wasn’t hugely experienced with renovation work, he had spent some time farming and completing building while he was backpacking, and had also taken odd jobs fixing peoples homes.",They bought an abandoned 'ghost house' in the Japanese countryside,29,,-0.05239970609545708,0.0
"He completed much of the work on the guesthouse himself, replacing the floors and adding in a toilet, which he says was a wedding present from his parents, at a cost of around $10,000.",They bought an abandoned 'ghost house' in the Japanese countryside,29,,-0.010914306156337261,0.0
"“I’m not really a professional,” he says.”",They bought an abandoned 'ghost house' in the Japanese countryside,-1,,0.040644217282533646,0.0
"I like to do carpentry and I enjoy creating things, but I have no experience in my background.",They bought an abandoned 'ghost house' in the Japanese countryside,-1,,-0.05836132913827896,0.0
"“From my several years of backpacking, I saw so many interesting buildings, so many houses of interesting shapes and I’ve been collecting those in my brain.”",They bought an abandoned 'ghost house' in the Japanese countryside,-1,,-0.0036602274049073458,0.0
Kajiyama was determined to keep the house as authentic as possible by using traditional materials.,They bought an abandoned 'ghost house' in the Japanese countryside,29,Kajiyama,-0.013540602289140224,0.95
He saved money by collecting traditional wood from building companies who were in the process of breaking down traditional houses.,They bought an abandoned 'ghost house' in the Japanese countryside,29,,-0.061962999403476715,0.0
"“They need to spend the money to throw it away,” he explains.",They bought an abandoned 'ghost house' in the Japanese countryside,107,,0.030184907838702202,0.0
"“But for me, some of the stuff is like treasure.",They bought an abandoned 'ghost house' in the Japanese countryside,118,,-0.027694983407855034,0.0
So I would go and take the material that I wanted.,They bought an abandoned 'ghost house' in the Japanese countryside,118,,-0.031146477907896042,0.0
"“The house is a very, very old style,” he says.",They bought an abandoned 'ghost house' in the Japanese countryside,-1,,-0.014154165051877499,0.0
“So it wouldn’t look nice if I brought in more modern materials.,They bought an abandoned 'ghost house' in the Japanese countryside,118,,0.01291076373308897,0.0
It’s totally authentic.”,They bought an abandoned 'ghost house' in the Japanese countryside,118,,-0.007319527678191662,0.0
"He explains that very little work had previously been done to the house, which is quite unusual for a home built so many years ago.",They bought an abandoned 'ghost house' in the Japanese countryside,29,,0.07564467191696167,0.0
"“It’s totally authentic,” he says.",They bought an abandoned 'ghost house' in the Japanese countryside,118,,-0.005819627549499273,0.0
"“Usually, with traditional houses, some renovations are made to the walls, because the insulation is not so strong.",They bought an abandoned 'ghost house' in the Japanese countryside,29,,0.02750355936586857,0.0
So you lose the style.”,They bought an abandoned 'ghost house' in the Japanese countryside,118,,0.020504271611571312,0.0
Lengthy process,They bought an abandoned 'ghost house' in the Japanese countryside,115,,0.05234892666339874,0.0
"He says he received some financial support from the government, which meant he was able to bring in a carpenter and also benefited from Japan’s working holiday program, which allows travelers to work in exchange for food and board, when he needed extra help.",They bought an abandoned 'ghost house' in the Japanese countryside,29,Japan,-0.008462540805339813,0.95
"After doing some research into Japanese guesthouse permits, he discovered that one of the simplest ways to acquire one would be to register the property as an agriculture guesthouse.",They bought an abandoned 'ghost house' in the Japanese countryside,29,,-0.009721622802317142,0.0
"As the area is filled with bamboo forests, this seemed like a no-brainer, and Kajiyama decided to learn everything he could about bamboo farming so that he could combine the two businesses.",They bought an abandoned 'ghost house' in the Japanese countryside,29,Kajiyama,-0.01273775938898325,0.95
"“This is how I started farming,” he says.",They bought an abandoned 'ghost house' in the Japanese countryside,-1,,-0.005984600633382797,0.0
"In 2014, two years after they began working on the house, the couple were finally able to welcome their first guests.",They bought an abandoned 'ghost house' in the Japanese countryside,29,,-0.00226556952111423,0.0
"“It was a beautiful feeling,” says Kajiyama.",They bought an abandoned 'ghost house' in the Japanese countryside,29,Kajiyama,-0.0036211195401847363,0.95
"“Of course, this was my dream.",They bought an abandoned 'ghost house' in the Japanese countryside,117,,-0.01757149025797844,0.0
But people really appreciate that it was abandoned and I brought it back to life.”,They bought an abandoned 'ghost house' in the Japanese countryside,107,,-0.014328560791909695,0.0
He says that hosting guests from all over the world has helped him to stay connected to his former life as a backpacker.,They bought an abandoned 'ghost house' in the Japanese countryside,29,,-0.003950327169150114,0.0
"“I stay in one place, but people come to me and I feel like I’m traveling,” he says.",They bought an abandoned 'ghost house' in the Japanese countryside,118,,-0.014850757084786892,0.0
"“Today, it’s Australia, tomorrow it’s the UK and next week South Africa and India.",They bought an abandoned 'ghost house' in the Japanese countryside,-1,"Australia, UK, South Africa, India",-0.01025413442403078,0.0
"“People come from different places and they invite me to join them for dinner, so sometimes I join someone’s family life.”",They bought an abandoned 'ghost house' in the Japanese countryside,118,,-0.008967474102973938,0.0
"Sadly, Hila passed away from cancer in 2022.",They bought an abandoned 'ghost house' in the Japanese countryside,29,Hila,0.010683932341635227,0.95
Kajiyama stresses that his beloved wife played a huge part in helping him achieve his dream of having a guesthouse and says he couldn’t have done it without her.,They bought an abandoned 'ghost house' in the Japanese countryside,29,Kajiyama,-0.007903628051280975,0.95
"“We were really together,” he adds.",They bought an abandoned 'ghost house' in the Japanese countryside,118,,-0.006035327911376953,0.0
“She created this place with me.,They bought an abandoned 'ghost house' in the Japanese countryside,118,,-0.025151001289486885,0.0
Without her it would not have been like this.”,They bought an abandoned 'ghost house' in the Japanese countryside,118,,0.12043885141611099,0.0
"While the three-bedroom guesthouse, which measures around 80 square meters, has been open for around eight years, Kajiyama is still working on it, and says he has no idea when he’ll be finished.",They bought an abandoned 'ghost house' in the Japanese countryside,29,Kajiyama,0.04023900628089905,0.95
"“It’s never ending,” he admits.",They bought an abandoned 'ghost house' in the Japanese countryside,118,,-0.055059731006622314,0.0
"“I’m halfway, I feel.",They bought an abandoned 'ghost house' in the Japanese countryside,-1,,-0.015479390509426594,0.0
It is beautiful already.,They bought an abandoned 'ghost house' in the Japanese countryside,29,,-0.006113125942647457,0.0
"But it started off abandoned, so it needs more details.",They bought an abandoned 'ghost house' in the Japanese countryside,107,,0.01737068220973015,0.0
"And I’m getting better at creating, so I need time to do it.”",They bought an abandoned 'ghost house' in the Japanese countryside,115,,-0.007191828917711973,0.0
Complete transformation,They bought an abandoned 'ghost house' in the Japanese countryside,115,,-0.032313112169504166,0.0
He explains that he’s unable to complete work on the home while guests are there.,They bought an abandoned 'ghost house' in the Japanese countryside,29,,0.014581703580915928,0.0
"And while the property is closed during the winter, he spends two months as a bamboo farmer and usually spends a month traveling, which doesn’t leave him much time for renovations.",They bought an abandoned 'ghost house' in the Japanese countryside,29,,-0.0478602796792984,0.0
"“Sometimes I don’t do anything,” he admits.",They bought an abandoned 'ghost house' in the Japanese countryside,-1,,0.04413778334856033,0.0
