sentence,article,cluster,entities,sentiment,bias_score
استرالیا میگوید که اخراج سفیر ایران بر مبنای «اطلاعات داخلی» بود، نه گزارش موساد بعد از آنکه موساد یک واحد نیروی قدس سپاه را به دست داشتن در حملاتی علیه اهداف یهودی در استرالیا و نقاط دیگر جهان متهم کرد و مدعی شد مسئول هدایت این واحد را شناسایی کرده است، استرالیا گفت که واکنش دو ماه پیشش به این حملات، بر اساس اطلاعات نهادهای استرالیایی بوده است. دفتر نخستوزیر اسرائیل و موساد در بیانیهای که دیروز منتشر شد، سپاه پاسداران را به ایجاد «سازوکاری عمده» برای حمله به اهداف یهودی و اسرائیلی متهم کردند و گفتند که «برای نخستین بار افشا» میکنند که «سردار عمار» فرمانده یگان ۱۱۰۰۰ نیروی قدس سپاه پاسداران، مسئول هدایت این سازوکار است که برای حمله به اهدافی در داخل و خارج از اسرائیل ایجاد شده است. در این بیانیه از جمله به حملاتی در استرالیا اشاره شد که کانبرا آن را دو ماه پیش به تهران نسبت داد و بر همین اساس سفیر ایران را هم اخراج کرد. اکنون تونی بورک، وزیر کشور استرالیا، در بیانیهای به شبکه خبری اسبیاس گفت که رفتار ایران «شرمآور» بود اما تاکید کرد که تصمیمات دولت استرالیا فقط بر اساس اطلاعات نهادهای داخلی بوده است: «رفتار ایران شرمآور بود. برای همین بود که سفیر را اخراج کردیم و در حال تدوین قوانینی هستیم که (ما را) قادر میسازد نهادهای مرتبط با یک دولت را سازمان تروریستی طبقهبندی کنیم.» دولت استرالیا ۲۶ اوت/۴ شهریور اعلام کرد که سفیر ایران را اخراج میکند، آنتونی آلبانیزی، نخستوزیر استرالیا، تهران را به دست داشتن در دو حمله یهودستیزانه در شهرهای سیدنی و ملبورن متهم کرد. دولت استرالیا احمد صادقی، سفیر ایران، را «عنصر نامطلوب» اعلام کرد و به او و سه مقام دیگر جمهوری اسلامی هفت روز فرصت داد تا خاک آن کشور را ترک کنند. اسماعیل بقایی، سخنگوی وزارت خارجه ایران، این اتهامات را تکذیب کرد و گفت: «یهودستیزی در سیاست ما هیچ جایی ندارد.» آقای آلبانیزی در یک کنفرانس مطبوعاتی گفت که نهاد اطلاعاتی-امنیتی استرالیا اطلاعات «موثقی» را جمعآوری کرده است که نشان میدهد دولت ایران در «هدایت حداقل دو حمله» در کشورش نقش داشته است: «ایران تلاش کرده است تا دخالت خود را پنهان کند، اما نهاد اطلاعاتی استرالیا ارزیابی میکند که [جمهوری اسلامی] در پشت حملات به آشپزخانه لوئیس کانتینتال در سیدنی در ۲۰ اکتبر سال گذشته و کنیسه آداس اسرائیل در ملبورن در ۶ دسامبر بوده است.» هیچ گزارشی در مورد کشته یا مجروح شدن کسی در این دو حمله منتشر نشد. آقای آلبانیزی گفت: «اینها اقدامات تجاوزکارانه غیرعادی و خطرناکی بودند که یک کشور خارجی در خاک استرالیا سازماندهی کرد.»,استرالیا: اخراج سفیر ایران بر مبنای اطلاعات داخلی بود، نه گزارش موساد - BBC News فارسی,0,,0.0,0.0
او این اقدامات را تلاشهایی «برای تضعیف انسجام اجتماعی و ایجاد اختلاف» در جامعه استرالیا توصیف کرد و گفت ایران حملات بیشتری را برنامهریزی کرده بود. او گفته بود دولت استرالیا قصد دارد سپاه پاسداران انقلاب اسلامی را به عنوان یک سازمان «تروریستی» معرفی کند. ایران بارها این اتهامات را تکذیب کرده است. اسماعیل بقایی، سخنگوی وزارت خارجه ایران، در واکنش به این اقدام استرالیا گفته بود: «این اتهام مطلقا مردود است و اساسا مفهوم یهودستیزی در فرهنگ دین و تاریخ ما جایی ندارد و پدیدهای غربی و اروپایی است.» بیانیه موساد در مورد نقش نیروی قدس چه میگفت؟ سازمان جاسوسی اسرائیل، موساد، سپاه پاسداران را به ایجاد «سازوکاری عمده» برای حمله به اهداف یهودی و اسرائیلی متهم کرده و میگوید که فرمانده یگانی را که مسئول این کارزار است شناسایی کرده است. دفتر نخستوزیر اسرائیل و موساد در بیانیهای مشترک گفتند که «برای نخستین بار افشا» میکنند که «سردار عمار» فرمانده یگان ۱۱۰۰۰ نیروی قدس سپاه پاسداران، مسئول هدایت این سازوکار است که برای حمله به اهدافی در داخل و خارج از اسرائیل ایجاد شده است. بیانیه موساد و نخستوزیری اسرائیل یگان تحت هدایت سردار عمار را مسئول «حملات بزرگ ناکام در استرالیا، یونان و آلمان در سالهای ۲۰۲۴ تا ۲۰۲۵» معرفی میکند. این بیانیه میگوید که «ترور بدون به جا گذاشتن رد، تقسیم کردن عملیات به اجزاء بسیار کوچک، استخدام خارجیها، استفاده از مجرمان و ارتباط محرمانه» از روشهای ایران برای «پیشبرد تروریسم در دنیا» هستند. این بیانیه همچنین ایران را متهم کرده است که از زمان حمله ۷ اکتبر حماس، تلاش برای هدف قرار دادن منافع اسرائیلی و یهودی در سراسر جهان را گسترش داده است. جزئیات بیشتری درباره «سردار عمار» یا نحوه عملیات یگان او در بیانیه نیامده است اما ایران پیش از این به دست داشتن در حملاتی علیه اهداف یهودی و اسرائیلی متهم شده بود؛ پر سروصداترین مورد آن در استرالیا بود که به افزایش تنش میان این کشور و ایران منجر شد.,استرالیا: اخراج سفیر ایران بر مبنای اطلاعات داخلی بود، نه گزارش موساد - BBC News فارسی,0,,0.0,0.0
Biker in serious condition after A76 crash,Biker in serious condition after A76 crash near Enterkinfoot,99,,0.01689867302775383,0.0
A biker is in a serious condition in hospital after a crash on the A76 in southern Scotland.,Biker in serious condition after A76 crash near Enterkinfoot,99,Scotland,0.011908258311450481,0.0
Emergency services were called out to the scene near Enterkinfoot - between Thornhill and Sanquhar - at about 13:00 on Sunday.,Biker in serious condition after A76 crash near Enterkinfoot,-1,"Thornhill, Sanquhar",0.021172042936086655,0.0
The accident involved a black Vauxhall Astra and a black Ducati motorbike.,Biker in serious condition after A76 crash near Enterkinfoot,99,"Vauxhall, Ducati",0.017774658277630806,0.0
The 60-year-old biker was taken to hospital where he remains in a serious condition.,Biker in serious condition after A76 crash near Enterkinfoot,99,,0.015732748433947563,0.0
The occupants of the car involved were not injured.,Biker in serious condition after A76 crash near Enterkinfoot,-1,,0.09302247315645218,0.0
The road was closed for investigations to be carried out and fully reopened at about 17:20.,Biker in serious condition after A76 crash near Enterkinfoot,-1,,0.022460827603936195,0.0
"Sgt Colin Ramage said: ""I am appealing to anyone who was on the A76 around lunchtime on Sunday and saw what happened, or may have observed either vehicle prior to the crash, to contact us.",Biker in serious condition after A76 crash near Enterkinfoot,99,Colin Ramage,0.03179997578263283,0.0
"""I'm particularly keen to speak to the driver of an HGV seen travelling southbound around the time of the crash.",Biker in serious condition after A76 crash near Enterkinfoot,99,,0.06569431722164154,0.0
"""I believe they may have vital information.""",Biker in serious condition after A76 crash near Enterkinfoot,-1,,-0.006895736791193485,0.0
"Surfboard lost in Tasmania drifts more than 2,400km to New Zealand","Lost surfboard in Tasmania drifts more than 2,400km to New Zealand",60,"Tasmania, New Zealand",0.015915127471089363,0.7124999999999999
"A custom-made surfboard which fell off a boat in Tasmania almost 18 months ago has been found off the west coast of New Zealand, after drifting about 2,400 km (1,490 miles) across the sea.","Lost surfboard in Tasmania drifts more than 2,400km to New Zealand",60,"Tasmania, New Zealand",0.017392998561263084,0.7124999999999999
Frenchman Alvaro Bon was kitesurfing in Raglan Harbour on the North Island about two weeks ago when he found the barnacle-covered board.,"Lost surfboard in Tasmania drifts more than 2,400km to New Zealand",60,"Alvaro Bon, Raglan Harbour, the North Island",-0.031639568507671356,0.0
He posted his find on several online surfing groups and,"Lost surfboard in Tasmania drifts more than 2,400km to New Zealand",-1,,-0.007513491902500391,0.0
"days later, a friend of the board's owner recognised it and connected the pair.","Lost surfboard in Tasmania drifts more than 2,400km to New Zealand",60,,-0.011480269022285938,0.0
"The board will be collected in Auckland this week, and reunited with its Australian owner, known only as Liam, who says the board was blown overboard in May 2024.","Lost surfboard in Tasmania drifts more than 2,400km to New Zealand",60,"Auckland, Liam",0.027960706502199173,0.475
"""He couldn't believe it,"" Bon told the BBC, adding that the board was irreplaceable because the designer no longer makes surfboards.","Lost surfboard in Tasmania drifts more than 2,400km to New Zealand",60,"Bon, BBC",0.06624304503202438,0.475
"The 30-year-old, who has lived in New Zealand for about ten years and kitesurfs in Raglan daily, said the day he found the board, he had been forced to let go of his kite due to particularly strong currents.","Lost surfboard in Tasmania drifts more than 2,400km to New Zealand",60,"New Zealand, Raglan",0.06674111634492874,0.95
It was a split-second decision to sacrifice his kite or risk being swept out to sea.,"Lost surfboard in Tasmania drifts more than 2,400km to New Zealand",60,,0.028940806165337563,0.0
"He sought refuge on a remote side of the harbour before spotting the cream-coloured 7ft 6in (229cm) board, covered in mussels and barnacles but remarkably undamaged.","Lost surfboard in Tasmania drifts more than 2,400km to New Zealand",60,,0.05899498611688614,0.0
"He hid it in the sand dunes and returned a few days later before kitesurfing the board back to the harbour - holding it under one arm, while grabbing his kite with his other hand.","Lost surfboard in Tasmania drifts more than 2,400km to New Zealand",60,,-0.016795365139842033,0.0
"After cleaning the board, he took to social media to try find its owner, posting pictures that showed the unique signature of the board's designer.","Lost surfboard in Tasmania drifts more than 2,400km to New Zealand",60,,-0.0072926306165754795,0.0
"""Definitely not an everyday board...","Lost surfboard in Tasmania drifts more than 2,400km to New Zealand",60,,0.03089095465838909,0.0
"Wonder if the board could have drifted from east Australia??"" he wrote.","Lost surfboard in Tasmania drifts more than 2,400km to New Zealand",60,Australia,0.02427370660007,0.0
"""I remember I posted the pictures in the message and then I went for a surf in Raglan again,"" Bon said.","Lost surfboard in Tasmania drifts more than 2,400km to New Zealand",-1,Raglan,-0.005992087069898844,0.0
"When he returned, his phone was full of replies about the mystery board, with hundreds of people sharing the post and even more commenting on the unusual find.","Lost surfboard in Tasmania drifts more than 2,400km to New Zealand",60,,-0.016030071303248405,0.0
"After his friend spotted the board, Liam sent Bon pictures of the board to prove its ownership and organised for a family friend to pick it up and bring it home.","Lost surfboard in Tasmania drifts more than 2,400km to New Zealand",60,"Liam, Bon",-0.010389723815023899,0.475
"As for his fateful discovery, Bon was philosophical about it.","Lost surfboard in Tasmania drifts more than 2,400km to New Zealand",-1,Bon,-0.07402611523866653,0.0
"""Every story has got a meaning to it... the day I found the surfboard, I lost my kite at the same time,"" he said.","Lost surfboard in Tasmania drifts more than 2,400km to New Zealand",60,,-0.09014137834310532,0.0
"""Maybe that's the meaning... sometimes you need to let go of some stuff to find better.""","Lost surfboard in Tasmania drifts more than 2,400km to New Zealand",118,,-0.05605120211839676,0.0
Share your views on shock Rodgers exit - Published In a stunning turn of events Brendan Rodgers has resigned as Celtic manager.,What do you make of Rodgers exit? And who should replace him? - BBC Sport,72,"Rodgers, Brendan Rodgers, Celtic",0.06077485904097557,0.9499999999999998
"Martin O'Neill returns to the club to take interim charge along with former forward Shaun Maloney, with Celtic saying ""the process to appoint a new permanent manager is under way"".",What do you make of Rodgers exit? And who should replace him? - BBC Sport,72,"Martin O'Neill, Shaun Maloney, Celtic",-0.005070660728961229,0.95
Rodgers departs with Celtic trailing Premiership leaders Hearts by eight points following Sunday's 3-1 defeat at Tynecastle.,What do you make of Rodgers exit? And who should replace him? - BBC Sport,72,"Rodgers, Celtic, Premiership, Hearts",0.015235329046845436,0.95
What do you make of the bombshell news?,What do you make of Rodgers exit? And who should replace him? - BBC Sport,92,,0.027790311723947525,0.0
Was it the right time for Rodgers to end his second spell?,What do you make of Rodgers exit? And who should replace him? - BBC Sport,72,Rodgers,0.029657159000635147,0.95
And who should replace him?,What do you make of Rodgers exit? And who should replace him? - BBC Sport,80,,0.014177590608596802,0.0
Wolves 2-3 Burnley - the fans' verdict - Published,Wolves 2-3 Burnley: Fan views - BBC Sport,64,"Wolves, Burnley",-0.012810664251446724,0.95
We asked for your thoughts after Sunday's Premier League game between Wolves and Burnley.,Wolves 2-3 Burnley: Fan views - BBC Sport,64,"Premier League, Wolves, Burnley",-0.00439812708646059,0.95
Here are some of your comments:,Wolves 2-3 Burnley: Fan views - BBC Sport,57,,-0.017019210383296013,0.0
Wolves fans Richard:,Wolves 2-3 Burnley: Fan views - BBC Sport,64,"Wolves, Richard",-0.01562575437128544,0.95
"Wolves have identity, which the manager says we need.",Wolves 2-3 Burnley: Fan views - BBC Sport,64,Wolves,-0.02293071337044239,0.95
I'm not sure why people say we don't.,Wolves 2-3 Burnley: Fan views - BBC Sport,-1,,0.023222774267196655,0.0
"We play, pick the ball out of the net and lose.",Wolves 2-3 Burnley: Fan views - BBC Sport,80,,0.015435418114066124,0.0
That's an identity.,Wolves 2-3 Burnley: Fan views - BBC Sport,118,,0.10802154988050461,0.0
I feel really bad for Vitor.,Wolves 2-3 Burnley: Fan views - BBC Sport,-1,Vitor,0.007678280118852854,0.0
"He saved us last year, but things keep going wrong.",Wolves 2-3 Burnley: Fan views - BBC Sport,80,,0.009306364692747593,0.0
Something has to change…but not sure changing the manager is always the best option.,Wolves 2-3 Burnley: Fan views - BBC Sport,72,,0.0286718737334013,0.0
Tony: Terrible match.,Wolves 2-3 Burnley: Fan views - BBC Sport,-1,Tony,0.007415398955345154,0.0
"Neither side were impressive, but Burnley deserved their win.",Wolves 2-3 Burnley: Fan views - BBC Sport,64,Burnley,-0.060644324868917465,0.95
O'Neil got the sack for less.,Wolves 2-3 Burnley: Fan views - BBC Sport,-1,O'Neil,0.051405590027570724,0.0
Very unimpressive.,Wolves 2-3 Burnley: Fan views - BBC Sport,-1,,0.014330128207802773,0.0
Lacking creativity and any real goal scorer.,Wolves 2-3 Burnley: Fan views - BBC Sport,-1,,0.012132884934544563,0.0
The Championship is the only destination now for Wolves.,Wolves 2-3 Burnley: Fan views - BBC Sport,64,"Championship, Wolves",-0.06623890995979309,0.95
Burnley fans Neil: Excellent performance despite a highly dubious penalty; we stayed strong and deserved to win.,Wolves 2-3 Burnley: Fan views - BBC Sport,64,"Burnley, Neil",-0.007949337363243103,0.95
"Apart from the win, the important thing is that they are consistently scoring goals, which has been missing in the past.",Wolves 2-3 Burnley: Fan views - BBC Sport,64,,-0.011213402263820171,0.0
The game should have been over by half time.,Wolves 2-3 Burnley: Fan views - BBC Sport,-1,,0.013245747424662113,0.0
The finish from Flemming was incredible for Burnley's first.,Wolves 2-3 Burnley: Fan views - BBC Sport,64,"Flemming, Burnley",-0.003622794523835182,0.95
Wolves took advantage of that and looked much stronger in the second half.,Wolves 2-3 Burnley: Fan views - BBC Sport,64,Wolves,-0.005823775660246611,0.95
The Dubravka save right at the death was amazing.,Wolves 2-3 Burnley: Fan views - BBC Sport,-1,Dubravka,-0.009091060608625412,0.0
New congestion charge signs 'hidden' behind bushes,New Oxford congestion charge signs 'hidden' behind bushes,83,,0.012724652886390686,0.0
"A local authority has been criticised after a number of road signs detailing a new congestion charge were ""hidden"" behind overgrown bushes.",New Oxford congestion charge signs 'hidden' behind bushes,83,,0.0060607511550188065,0.0
Oxfordshire County Council's £5 congestion charge begins on Wednesday and will see cars charged for travelling on a number of roads in Oxford during specific hours.,New Oxford congestion charge signs 'hidden' behind bushes,83,"Oxfordshire County Council's, Oxford",0.020430870354175568,0.475
"Labour city councillor Simon Ottino said it was ""utterly daft"" that new signs alerting people to the charge had been placed behind out-of-control foliage.",New Oxford congestion charge signs 'hidden' behind bushes,83,"Labour, Simon Ottino",0.006963052321225405,0.0
The county council said that it had arranged for the vegetation to be cleared before the congestion charge comes into force.,New Oxford congestion charge signs 'hidden' behind bushes,83,,-0.014424717053771019,0.0
"While hedge cutting is usually the responsibility of the landowner, the authority can intervene if there is a significant safety hazard.",New Oxford congestion charge signs 'hidden' behind bushes,68,,0.03529883176088333,0.0
"Mr Ottino claimed the county council was ""failing in its duty if it allows the view of any of its road signs to be obstructed by overhanging branches"".",New Oxford congestion charge signs 'hidden' behind bushes,82,Ottino,0.008447541855275631,0.0
"""It is utterly daft if it puts a new sign up in a position where a view of it is obstructed by branches,"" he said.",New Oxford congestion charge signs 'hidden' behind bushes,82,,0.01028289832174778,0.0
"Richard Parnham, from campaign group Reconnecting Oxford, said many people ""haven't properly been alerted to the congestion charge scheme"".",New Oxford congestion charge signs 'hidden' behind bushes,83,"Richard Parnham, Reconnecting Oxford",0.015077963471412659,0.0
"""And yet, in a way that is typical of the way this whole rushed scheme has been introduced - we've seen congestion charge signs put up directly behind other signs and hidden behind trees and bushes all over the city,"" he said.",New Oxford congestion charge signs 'hidden' behind bushes,83,,0.012783454731106758,0.0
"""Someone needs to be held accountable for this shambles, urgently.""",New Oxford congestion charge signs 'hidden' behind bushes,-1,,0.012467220425605774,0.0
"Councillor Andrew Gant, the authority's transport chief, said: ""An officer audit of signage for the Oxford temporary congestion charge has been completed, and contractors are currently arranging clearance works.",New Oxford congestion charge signs 'hidden' behind bushes,83,"Andrew Gant, Oxford",-0.008611193858087063,0.475
"""Out of approximately 90 sign locations, six have been identified as partially obstructed from a driver's point of view.",New Oxford congestion charge signs 'hidden' behind bushes,-1,,0.01526567991822958,0.0
"""These are being prioritised to ensure visibility is restored ahead of the scheme's commencement [on] Wednesday.",New Oxford congestion charge signs 'hidden' behind bushes,-1,,-0.004838595166802406,0.0
"""The council will maintain clear and compliant signage throughout the life of the scheme,"" he added.",New Oxford congestion charge signs 'hidden' behind bushes,82,,-0.009321213699877262,0.0
"You can follow BBC Oxfordshire on Facebook, X (Twitter), or Instagram.",New Oxford congestion charge signs 'hidden' behind bushes,20,"BBC Oxfordshire, Facebook, Instagram",-0.004567192401736975,0.95
"Man City can still win the league, says Reijnders",Man City news: Tijjani Reijnders says City remain Premier League title contenders - BBC Sport,71,"Man City, Reijnders",-0.00972275622189045,0.475
"- Published Midfielder Tijjani Reijnders says he has ""a lot of trust"" that Manchester City can still win the Premier League this season, despite suffering a setback on Sunday.",Man City news: Tijjani Reijnders says City remain Premier League title contenders - BBC Sport,71,"Tijjani Reijnders, Manchester City, the Premier League",-0.008343763649463654,0.0
City's nine-game unbeaten run in all competitions was brought to an end by a 1-0 defeat at Aston Villa.,Man City news: Tijjani Reijnders says City remain Premier League title contenders - BBC Sport,72,"City, Aston Villa",0.04874487593770027,0.0
"It also ended striker Erling Haaland's 12-game scoring streak and left City in fifth position, six points adrift of league leaders Arsenal.",Man City news: Tijjani Reijnders says City remain Premier League title contenders - BBC Sport,-1,"Erling Haaland, City, Arsenal",-0.017389662563800812,0.0
"""I don't think it's the inconsistency,"" said Dutchman Reijnders.",Man City news: Tijjani Reijnders says City remain Premier League title contenders - BBC Sport,119,Reijnders,0.047145865857601166,0.0
"""The streak we set is pretty long.",Man City news: Tijjani Reijnders says City remain Premier League title contenders - BBC Sport,80,,-0.06427793204784393,0.0
But we know this game we weren't at our best and we can do much better.,Man City news: Tijjani Reijnders says City remain Premier League title contenders - BBC Sport,80,,0.08432517945766449,0.0
"""With the amount of games we play each week, we have to [put this result aside].",Man City news: Tijjani Reijnders says City remain Premier League title contenders - BBC Sport,80,,0.0875563696026802,0.0
"""We have to focus on Wednesday against Swansea, we have to recover well and be ready for that game.""",Man City news: Tijjani Reijnders says City remain Premier League title contenders - BBC Sport,80,Swansea,-0.011375423520803452,0.0
"Asked if City can still finish top, Reijnders said: ""Of course.",Man City news: Tijjani Reijnders says City remain Premier League title contenders - BBC Sport,71,"City, Reijnders",-0.011168139055371284,0.475
It's a long journey and there are a lot of games coming.,Man City news: Tijjani Reijnders says City remain Premier League title contenders - BBC Sport,-1,,-0.026836173608899117,0.0
"Six points - we can close that gap of course, as long as we focus on ourselves I have a lot of trust in that.",Man City news: Tijjani Reijnders says City remain Premier League title contenders - BBC Sport,80,,-0.011330550536513329,0.0
"""It's a bummer that we lost here, but it's a long journey in this league and we have plenty of games.",Man City news: Tijjani Reijnders says City remain Premier League title contenders - BBC Sport,80,,0.12341005355119705,0.0
"We have to keep working and keep fighting for the Premier League.""",Man City news: Tijjani Reijnders says City remain Premier League title contenders - BBC Sport,80,the Premier League,-0.008199567906558514,0.0
Fan cycles 900 miles to support football team,Cycling 900 miles for Truro City FC match was 'work of a madman',-1,,-0.0159570574760437,0.0
"A football fan cycled more than 900 miles from Cornwall to Tyne and Wear to see his football team play in the National League says he had a ""quite incredible"" response to his trip.",Cycling 900 miles for Truro City FC match was 'work of a madman',-1,"Cornwall, Tyne and Wear, the National League",-0.0028798473067581654,0.0
"Chris Willian travelled 914 miles (1,471km) on two manually-powered wheels from the county to see his team Truro City FC face Gateshead on Saturday.",Cycling 900 miles for Truro City FC match was 'work of a madman',-1,"Chris Willian, Truro City FC, Gateshead",-0.005090301390737295,0.0
